### ISSUE TITLE
Rspamd: RBL blocklists not working

### ISSUE THREAD

**Issue by Stefan1904** [opnsense/plugins#1403]
Like i mentioned in this thread: https://forum.opnsense.org/index.php?topic=13379.0
the RBL blocklists are not working in Rspamd 1.9.4 in OPNsense 19.1.10. There is no entry in the logs of any call to the RBL urls.

I already talked to mimugmail on the phone and he confirmed the problem.

**Comment by mimugmail** [comment]
This happens when a mail arrives:

```
09:29:18.259120 IP 81.24.66.162.63773 > 8.8.8.8.53: 48487+ [1au] A? facebook.com.dbl.spamhaus.org. (58)
09:29:18.267923 IP 8.8.8.8.53 > 81.24.66.162.63773: 48487 NXDomain 0/1/1 (122)
09:29:19.263067 IP 81.24.66.162.53725 > 8.8.8.8.53: 20621+ [1au] A? 1.0.0.127.zen.spamhaus.org. (55)
09:29:19.272331 IP 8.8.8.8.53 > 81.24.66.162.53725: 20621 NXDomain 0/1/1 (119)
09:29:24.350977 IP 81.24.66.162.64316 > 8.8.8.8.53: 7586+ [1au] A? maps.rspamd.com. (44)
09:29:24.351036 IP 81.24.66.162.18383 > 8.8.8.8.53: 36615+ [1au] AAAA? maps.rspamd.com. (44)
09:29:24.352458 IP 8.8.8.8.53 > 81.24.66.162.64316: 7586 1/0/1 A 88.99.142.95 (60)
09:29:24.358647 IP 8.8.8.8.53 > 81.24.66.162.18383: 36615 0/1/1 (105)
09:29:24.810349 IP 81.24.66.162.1521 > 8.8.8.8.53: 54776+ [1au] A? maps.rspamd.com. (44)
09:29:24.810496 IP 81.24.66.162.62758 > 8.8.8.8.53: 5361+ [1au] AAAA? maps.rspamd.com. (44)
09:29:24.820256 IP 8.8.8.8.53 > 81.24.66.162.62758: 5361 0/1/1 (105)
09:29:24.821331 IP 8.8.8.8.53 > 81.24.66.162.1521: 54776 1/0/1 A 88.99.142.95 (60)
09:29:33.020829 IP 81.24.66.162.24595 > 8.8.8.8.53: 6168+ [1au] A? 1.0.0.127.bl.score.senderscore.com. (63)
09:29:33.022140 IP 8.8.8.8.53 > 81.24.66.162.24595: 6168 NXDomain 0/1/1 (125)
09:29:35.650969 IP 81.24.66.162.18197 > 8.8.8.8.53: 36483+ [1au] A? 1.0.0.127.ix.dnsbl.manitu.net. (58)
09:29:35.659273 IP 8.8.8.8.53 > 81.24.66.162.18197: 36483 NXDomain 0/1/1 (120)
09:29:46.805422 IP 81.24.66.162.12810 > 8.8.8.8.53: 58922+ [1au] A? 1.0.0.127.b.barracudacentral.org. (61)
09:29:46.925249 IP 8.8.8.8.53 > 81.24.66.162.12810: 58922 NXDomain 0/0/1 (61)
09:29:48.110402 IP 81.24.66.162.53725 > 8.8.8.8.53: 36180+ [1au] A? facebook.com.fresh15.spameatingmonkey.net. (70)
09:29:48.123299 IP 8.8.8.8.53 > 81.24.66.162.53725: 36180 NXDomain 0/1/1 (141)
09:29:49.332995 IP 81.24.66.162.24196 > 8.8.8.8.53: 39691+ [1au] A? 1.0.0.127.bl.spameatingmonkey.net. (62)
09:29:49.334402 IP 8.8.8.8.53 > 81.24.66.162.24196: 39691 NXDomain 0/1/1 (133)
09:29:52.716793 IP 81.24.66.162.62758 > 8.8.8.8.53: 62322+ [1au] A? facebook.com.public.sarbl.org. (58)
09:29:52.725048 IP 8.8.8.8.53 > 81.24.66.162.62758: 62322 0/1/1 (109)
09:29:54.372246 IP 81.24.66.162.60989 > 8.8.8.8.53: 3755+ PTR? 51.222.85.209.in-addr.arpa. (44)
09:29:54.394670 IP 8.8.8.8.53 > 81.24.66.162.60989: 3755 1/0/0 PTR mail-ua1-f51.google.com. (81)
09:29:54.394887 IP 81.24.66.162.3649 > 8.8.8.8.53: 16313+ A? mail-ua1-f51.google.com. (41)
09:29:54.422682 IP 8.8.8.8.53 > 81.24.66.162.3649: 16313 1/0/0 A 209.85.222.51 (57)

```

So in general, the system works. But it checks against 127.0.0.1 which will never be blacklisted.

**Comment by Stefan1904** [comment]
I cannot find such entries in my rspamd.log

**Comment by mimugmail** [comment]
It's just a packet capture :)

**Comment by mimugmail** [comment]
Ok, the thing with 127.0.0.1 is just a regular test if DNS RBL is still active:
https://rspamd.com/doc/faq.html#what-are-monitored-checks

When I manually add barracudacentral it seems to work. I need to compare configdump to see what's missing. Will take some days.

**Comment by mimugmail** [comment]
Ok, I compared the config dumps and read through FAQ, I have no idea why it doesn't use RBL's by default.
I'd create a new subtab called RBL and let the user choose which RBLs to use with a default weight for all. 

@fabianfrz ok for you?

**Comment by fabianfrz** [comment]
@mimugmail Handle the plugin like yours. I originally wrote it to offload you at writing the postfix plugin.

**Comment by mimugmail** [comment]
Let's see how long the kids will sleep tomorrow to find a nice time frame for this task :)

**Comment by mimugmail** [comment]
@Stefan1904 I found the error. You are using a forwarder for OPN correct? 
You have to use your local Unbound and nothing like 8.8.8.8 since these addresses are blocked at the big RBLs. 

While testing the code I switched to direct DNS and it's already working

**Comment by Stefan1904** [comment]
@mimugmail I don't use a forwarder in OPNsense. The checkbox in Unbound for DNS Query Forwarding is diabled and there are no DNS server entries in the System Settings General section.

I can't even get the RBLs working in Postfix when i add them there to the main.cf file (service restartet of course).

Don't know if it has to do with our internet provider then. We have a fiber connection (htp). 
Locally we have: Internet -> htp device -> router -> port forwarding to OPNsense.

**Comment by mimugmail** [comment]
Can you do a packet capture on wan for port 53 when a mail arrives?

**Comment by Stefan1904** [comment]
Here is a part of it. The email was send from freenet.de (Rspamd shows a sender ip of 195.4.92.93)

18:32:02.913722 IP OPNsense.localdomain.59760 > dnsblpub01.datev.de.domain: 23635% [1au] A? 93.92.4.195.ix.dnsbl.manitu.net. (60)
18:32:02.915764 IP rbldns.nordu.net.domain > OPNsense.localdomain.45765: 22355 NXDomain*- 0/1/0 (102)
18:32:02.915880 IP OPNsense.localdomain.13006 > 134-225-68-194.static.edis.at.domain: 42585% [1au] A? 122.92.4.195.zen.spamhaus.org. (58)
18:32:02.918294 IP 240.56.235.37.in-addr.arpa.domain > OPNsense.localdomain.57945: 37328 NXDomain*- 0/1/0 (111)
18:32:02.919220 IP 217.160.177.94.domain > OPNsense.localdomain.32944: 6907 NXDomain*- 0/1/0 (111)
18:32:02.930378 IP 240.56.235.37.in-addr.arpa.domain > OPNsense.localdomain.53195: 20448 NXDomain*- 0/1/0 (112)
18:32:02.931731 IP dnsblpub01.datev.de.domain > OPNsense.localdomain.59760: 23635 NXDomain*- 0/1/1 (122)
18:32:02.931811 IP OPNsense.localdomain.13969 > ix-bl.ns.ecotel.net.domain: 52068% [1au] A? 93.92.4.195.ix.dnsbl.manitu.net. (60)
18:32:02.940407 IP ix-bl.ns.ecotel.net.domain > OPNsense.localdomain.13969: 52068 NXDomain*- 0/1/1 (122)
18:32:02.946415 IP 161.130.71.194.in-addr.arpa.domain > OPNsense.localdomain.39345: 60332 NXDomain*- 0/1/0 (110)
18:32:02.956182 IP usa.bl.blocklist.de.domain > OPNsense.localdomain.26830: 24894 NXDomain*- 0/0/0 (37)
18:32:02.956246 IP OPNsense.localdomain.58041 > de.bl.blocklist.de.domain: 56738% [1au] A? 195.bl.blocklist.de. (48)
18:32:02.956258 IP OPNsense.localdomain.48749 > de.bl.blocklist.de.domain: 39777% [1au] A? 164.92.4.195.bl.blocklist.de. (57)
18:32:02.960218 IP usa.bl.blocklist.de.domain > OPNsense.localdomain.30720: 22897 NXDomain*- 0/0/0 (37)
18:32:02.960290 IP OPNsense.localdomain.53694 > usa.bl.blocklist.de.domain: 34960% [1au] A? 93.92.4.195.bl.blocklist.de. (56)
18:32:02.965360 IP 134-225-68-194.static.edis.at.domain > OPNsense.localdomain.13006: 42585 NXDomain*- 0/1/0 (111)
18:32:02.965456 IP OPNsense.localdomain.15987 > 85.94.194.12.domain: 55229% [1au] A? 122.92.4.195.zen.spamhaus.org. (58)
18:32:02.976116 IP OPNsense.localdomain.16474 > de.bl.blocklist.de.domain: 54899% [1au] A? 194.211.14.81.bl.blocklist.de. (58)
18:32:02.979328 IP e.ns.urmombl.com.domain > OPNsense.localdomain.25143: 59886*- 0/1/0 (112)
18:32:02.979413 IP OPNsense.localdomain.47736 > c.ns.urmombl.com.domain: 18737% [1au] A? 81.bl.spameatingmonkey.net. (55)
18:32:02.979961 IP OPNsense.localdomain.45429 > de.bl.blocklist.de.domain: 12110% [1au] A? 122.92.4.195.bl.blocklist.de. (57)
18:32:02.989322 IP e.ns.urmombl.com.domain > OPNsense.localdomain.43390: 2092*- 0/1/0 (112)
18:32:02.989405 IP OPNsense.localdomain.21247 > e.ns.urmombl.com.domain: 18560% [1au] A? 195.bl.spameatingmonkey.net. (56)
18:32:03.003279 IP c.ns.urmombl.com.domain > OPNsense.localdomain.27062: 21202*- 0/1/0 (112)
18:32:03.004443 IP c.ns.urmombl.com.domain > OPNsense.localdomain.40766: 594*- 0/1/0 (112)
18:32:03.004508 IP OPNsense.localdomain.7736 > c.ns.urmombl.com.domain: 18741% [1au] A? 195.bl.spameatingmonkey.net. (56)
18:32:03.006239 IP 85.94.194.12.domain > OPNsense.localdomain.15987: 55229 NXDomain*- 0/1/0 (111)
18:32:03.056704 IP usa.bl.blocklist.de.domain > OPNsense.localdomain.53694: 34960 NXDomain*- 0/0/0 (45)
18:32:03.061560 IP OPNsense.localdomain.34420 > de.bl.blocklist.de.domain: 37057% [1au] A? 164.92.4.195.bl.blocklist.de. (57)
18:32:03.061570 IP OPNsense.localdomain.54323 > de.bl.blocklist.de.domain: 7608% [1au] A? 195.bl.blocklist.de. (48)
18:32:03.082320 IP OPNsense.localdomain.48497 > webserver3.blocklist.de.domain: 21755% [1au] A? 194.211.14.81.bl.blocklist.de. (58)
18:32:03.086337 IP OPNsense.localdomain.48983 > j302527.servers.jiffybox.net.domain: 34066% [1au] A? 122.92.4.195.bl.blocklist.de. (57)
18:32:03.094136 IP webserver3.blocklist.de.domain > OPNsense.localdomain.48497: 21755 ServFail- 0/0/0 (47)
18:32:03.094203 IP OPNsense.localdomain.23225 > de.bl.blocklist.de.domain: 46641% [1au] A? 194.211.14.81.bl.blocklist.de. (58)
18:32:03.098318 IP j302527.servers.jiffybox.net.domain > OPNsense.localdomain.48983: 34066 NXDomain*- 0/0/0 (46)
18:32:03.098393 IP OPNsense.localdomain.44235 > j302527.servers.jiffybox.net.domain: 22678% [1au] A? 122.92.4.195.bl.blocklist.de. (57)
18:32:03.110507 IP j302527.servers.jiffybox.net.domain > OPNsense.localdomain.44235: 22678 NXDomain*- 0/0/0 (46)
18:32:03.111331 IP e.ns.urmombl.com.domain > OPNsense.localdomain.21247: 18560 NXDomain*- 0/1/0 (116)
18:32:03.111400 IP OPNsense.localdomain.5385 > e.ns.urmombl.com.domain: 41276% [1au] A? 164.92.4.195.bl.spameatingmonkey.net. (65)
18:32:03.111437 IP OPNsense.localdomain.39146 > e.ns.urmombl.com.domain: 54267% [1au] A? 122.92.4.195.bl.spameatingmonkey.net. (65)
18:32:03.124151 IP c.ns.urmombl.com.domain > OPNsense.localdomain.47736: 18737 NXDomain*- 0/1/0 (115)
18:32:03.124241 IP OPNsense.localdomain.7617 > e.ns.urmombl.com.domain: 22490% [1au] A? 194.211.14.81.bl.spameatingmonkey.net. (66)
18:32:03.151437 IP c.ns.urmombl.com.domain > OPNsense.localdomain.7736: 18741 NXDomain*- 0/1/0 (116)
18:32:03.151512 IP OPNsense.localdomain.64198 > e.ns.urmombl.com.domain: 40292% [1au] A? 93.92.4.195.bl.spameatingmonkey.net. (64)
18:32:03.234237 IP e.ns.urmombl.com.domain > OPNsense.localdomain.5385: 41276 NXDomain*- 0/1/0 (125)
18:32:03.240762 IP e.ns.urmombl.com.domain > OPNsense.localdomain.39146: 54267 NXDomain*- 0/1/0 (125)
18:32:03.244293 IP e.ns.urmombl.com.domain > OPNsense.localdomain.7617: 22490 NXDomain*- 0/1/0 (126)
18:32:03.272035 IP OPNsense.localdomain.32222 > de.bl.blocklist.de.domain: 30931% [1au] A? 195.bl.blocklist.de. (48)
18:32:03.272100 IP OPNsense.localdomain.62388 > usa.bl.blocklist.de.domain: 13905% [1au] A? 164.92.4.195.bl.blocklist.de. (57)
18:32:03.274646 IP e.ns.urmombl.com.domain > OPNsense.localdomain.64198: 40292 NXDomain*- 0/1/0 (124)
18:32:03.285429 IP de.bl.blocklist.de.domain > OPNsense.localdomain.32222: 30931 NXDomain*- 0/0/0 (37)
18:32:03.285497 IP OPNsense.localdomain.42319 > j302527.servers.jiffybox.net.domain: 43363% [1au] A? 122.92.4.195.bl.blocklist.de. (57)
18:32:03.303570 IP OPNsense.localdomain.50744 > de.bl.blocklist.de.domain: 51265% [1au] A? 194.211.14.81.bl.blocklist.de. (58)
18:32:03.314990 IP j302527.servers.jiffybox.net.domain > OPNsense.localdomain.42319: 43363 NXDomain*- 0/0/0 (46)
18:32:03.370385 IP usa.bl.blocklist.de.domain > OPNsense.localdomain.62388: 13905 NXDomain*- 0/0/0 (46)
18:32:03.370468 IP OPNsense.localdomain.28620 > j302527.servers.jiffybox.net.domain: 49987% [1au] A? 164.92.4.195.bl.blocklist.de. (57)
18:32:03.393338 IP OPNsense.localdomain.47860 > webserver3.blocklist.de.domain: 23696% [1au]

**Comment by mimugmail** [comment]
And this looks perfect :)

**Comment by Stefan1904** [comment]
Then i don't know why not one spam mail was rejecting since i have Rspamd in use for a couple of weeks. I checked multiple IPs since then and they where listed on Spamhaus but which where not rejected although i have added a high score to the RBL symbols. And there is not one RBL symbol listed when i expand the entries in the Rspamd history in the GUI.

**Comment by mimugmail** [comment]
Maybe your provider redirects all DNS queries to their own forwarders. But in general this is how the technology works, dns request to RDNS IP including the provider domain:

`18:32:02.976116 IP OPNsense.localdomain.16474 > de.bl.blocklist.de.domain: 54899% [1au] A? 194.211.14.81.bl.blocklist.de. (58)`

So, the sending IP was 81.14.211.194 ..

**Comment by Stefan1904** [comment]
Today i got it working. I changed the server in /etc/resolv.conf from 127.0.0.1 to our internal Windows DNS Server and after that all RBLs started working. Don't know why Unbound DNS was not working.
