### ISSUE TITLE
OSPF config file with multiple OpenVPN needs more details

### ISSUE THREAD

**Issue by fintch** [opnsense/plugins#615]
Hello

I'm currently testing OPNSense in order to migrate from pfSense but I'm facing a small problem.
I'm using multiple OpenVPN links between several offices and using OSPFv2 (IPv4) to establish routing tables. But I can't specify configuration for each OpenVPN links. In fact, there is only one "openvpn" interface in generated ospfd config file which does not work as I expect.

In my mesh network, I have several "point-to-point" (OSPF config value) and one "point-to-multipoint" (I use to explicit this parameter and not let OSPF autodetect). That's why I need to use separate values between each OpenVPN network. And I also specify separate (and different) costs on each link.

As in closed bug #172 ospfd.conf file should use real (raw) OpenVPN name, and GUI should allow separate configuration. The same kind of problem had been discussed in closed #261.

If I want to migrate with actual OPNSense 18.1, the only working solution is to manually configure OSPF as suggested in #331 but it woult be nice if GUI helps as pfSense can do. And all discussions around my problem seems to be closed.

Should I wait for roadmap integration or continue to use manual way with native BSD package and shell configuration ?

Anyway, thanks a lot to the whole team for all work on this nice fork ! I already love OPNsense !
F!nTcH

**Comment by mimugmail** [comment]
Can you post your whole sh run?

**Comment by fabianfrz** [comment]
This is a known problem of core - It does not pass the correct interfaces in the InterfaceField to the GUI components.

**Comment by fintch** [comment]
Here is what pfSense gives me (with FRR plugin) :

!
frr version 3.0.2
frr defaults traditional
!
!
interface em1
 ip ospf cost 100
!
interface ovpnc4
 ip ospf cost 20
 ip ospf network point-to-point
!
interface ovpnc8
 ip ospf cost 50
 ip ospf network point-to-multipoint
!
interface ovpnc9
 ip ospf cost 20
 ip ospf network point-to-point
!
router ospf
 passive-interface em1
 network 10.0.1.0/24 area 10.0.0.0
 network 10.0.2.0/24 area 10.0.0.0
 network 10.254.10.0/24 area 10.0.0.0
 network 10.254.25.0/30 area 10.0.0.0
!
access-list dnr-list permit any
!
ip prefix-list ACCEPTFILTER seq 5 permit any
!
route-map ACCEPTFILTER permit 10
 match ip address prefix-list ACCEPTFILTER
!
route-map DNR permit 10
 match ip address dnr-list
!
ip protocol ospf route-map ACCEPTFILTER
!
line vty
!
end

But with OPNsense, I can only obtain :

!
frr version 3.0.3
frr defaults traditional
!
!
interface em1
 ip ospf cost 100
!
interface openvpn
 ip ospf cost 20
!
router ospf
 passive-interface em1
 network 10.0.1.0/24 area 10.0.0.0
 network 10.0.2.0/24 area 10.0.0.0
 network 10.254.10.0/24 area 10.0.0.0
 network 10.254.25.0/30 area 10.0.0.0
!
line vty
!
end

Anyway, I can't find any relevant opened issue neither in core (or I missed it) nor there in "plugins" repo.

Quoting drops my \n chars, and plain text drops indent, apologize for that...

Thanks

**Comment by fabianfrz** [comment]
This is the class of the InterfaceField: https://github.com/opnsense/core/blob/master/src/opnsense/mvc/app/models/OPNsense/Base/FieldTypes/InterfaceField.php#L123

As long as this class does not return the OpenVPN interfaces separately, no plugin and no new core component can assign anything to separate OpenVPN interfaces. The field will return the string 'openvpn'.

**Comment by fabianfrz** [comment]
BTW: you can use three backticks to format a config file or code.

**Comment by AdSchellevis** [comment]
@fabianfrz the devices are quite dynamic with OpenVPN if I'm not mistaken, which makes it difficult to return the correct "interface" in the current constellation. you can assign them (Interfaces->Assignments) and point to them, but as far as I know it's not guaranteed.

**Comment by fabianfrz** [comment]
@AdSchellevis I talked to @fichtner about the issue. A solution would be a persistent tun or tap device. In that case, it will be only assigned the the starting OpenVPN process.
The problem is that this would need a rewrite of the interfaces and the firewall section as well.

**Comment by fichtner** [comment]
all openvpn devices are static, they have fixed name with a unique id

**Comment by fabianfrz** [comment]
So they can be added to the InterfaceField? If yes, it would fix all plugins at once.

**Comment by fichtner** [comment]
first time we need this is not the best reason to enable it by default in the future ;)

**Comment by fabianfrz** [comment]
@fichtner we had this some time ago: #261

**Comment by fichtner** [comment]
If this is about latching on to "interfaces" it may be best to advertise OpenVPN nodes optionally, but it requires a bit of framework magic.

**Comment by mimugmail** [comment]
We probably just need a new fieldtype .. not InterfaceField, rather PyhsicalinterfaceField, @AdSchellevis any idea? :)

**Comment by fichtner** [comment]
That sounds like no integrity or guarantees for physical interfaces if it just reads them from the system as they happen to be there now. We can't rely on those names and should not imply "physical" knows OpenVPN internals, so it's either extending the current selector or adding other variants that know specific subtypes.

**Comment by mimugmail** [comment]
The main problem is that with InterfaceField and 
`
{% from 'OPNsense/Macros/interface.macro' import physical_interface %}`

Interface WAN will be igb0, but Interface OpenVPN will be openvpn.

**Comment by fichtner** [comment]
Yes, it returns the group, not the actual interfaces. These are hidden inside the OpenVPN models and these are not MVC yet. :)

**Comment by tvgdb** [comment]
+1 also encountering this issue

**Comment by mimugmail** [comment]
So, to summarize up. What's needed is an assignment of the interface in order to use it as InterfaceField. Most important is to no delete OpenVPN configs when still hanging in FRR. 

Also OSPF only works on TAP interface (cause of multicast) ... 

When both are given it *should* work. 

Can anyone confirm this?

**Comment by fabianfrz** [comment]
@mimugmail are you sure? There is also a subnet topology which looks like any other adapter: https://community.openvpn.net/openvpn/wiki/Topology

**Comment by fabianfrz** [comment]
I also have not tried it but it looks like a "normal" network adapter with a normal broadcast for v4. I run a IPv6 subnet though this topology and it works quite well - for sure without OSPF but you should know how much IPv6 depends on multicast ;)

**Comment by mimugmail** [comment]
```
root@OPN4:~ # tcpdump -n -i ovpnc1
tcpdump: verbose output suppressed, use -v or -vv for full protocol decode
listening on ovpnc1, link-type NULL (BSD loopback), capture size 262144 bytes
08:59:01.129890 IP 10.255.254.2 > 224.0.0.5: OSPFv2, Hello, length 44
08:59:01.130334 IP 10.255.254.1 > 10.255.254.2: ICMP 224.0.0.5 protocol 89 unreachable, length 36
08:59:11.140362 IP 10.255.254.2 > 224.0.0.5: OSPFv2, Hello, length 44
08:59:11.140797 IP 10.255.254.1 > 10.255.254.2: ICMP 224.0.0.5 protocol 89 unreachable, length 36
```

This comes when running `topology subnet`

**Comment by mimugmail** [comment]
With tap it's working fine.
My test setup:

![image](https://user-images.githubusercontent.com/20438689/45345510-d5be0980-b5a6-11e8-885e-c0492a43e402.png)

OPN1 and OPN2 are servers, LAN3 is switched, OPN3 and OPN4 are clients, LAN grey is switched. 3 connects to 1 and 4 to 2 via OpenVPN and OSPF enabled on all LANs and VPNs (so it's a circle). 
Runs fine:

![image](https://user-images.githubusercontent.com/20438689/45345656-46652600-b5a7-11e8-9a4a-5125503362b9.png)


![image](https://user-images.githubusercontent.com/20438689/45345677-5250e800-b5a7-11e8-83fd-a79784e65f75.png)


For me this one seems to be solved.
@fintch ok with this?

**Comment by mimugmail** [comment]
Sure, take your time, I just want to keep this going :)

**Comment by fintch** [comment]
I have tried the latest development version with a small test platform. My versions are OPNSense 19.1.a-288 and FRR package 1.4.

But according to my first post, I still encounter problems.

![virtualbox_linux 1_06_10_2018_19_26_14](https://user-images.githubusercontent.com/37588605/46574091-7df4a180-c99e-11e8-9fa6-f179aed16785.png)

As you can see on attached capture, I can't select OpenVPN interface to specify OSPF topology on each link. Perhaps I have done something wrong during installation or my setup is buggy.

@mimugmail : Can you post the resulting ospfd.conf ?
The routing table looks like correct but I'm interested in your generated configuration.

In peer links like your test platform, the test runs fine.
But in my case, I would like to specify something like this in ospfd.conf :
!
interface ovpnc4
  ip ospf network **point-to-point**
!
interface ovpnc8
  ip ospf network **point-to-multipoint**
!

The ovpnc8 client connects to a kind of remote access concentrator, and OSPF does not work correctly if I can't force a point-to-multipoint OSPF network. My target for closing this issue is this test case.

Anyway, thanks again to all people working on this great project !

**Comment by mimugmail** [comment]
You have to assign the Interface, enable Prevent Interface Removal and set IPv4 to none. Then restart OpenVPN. Now you will see it

**Comment by brilthor** [comment]
> So, to summarize up. What's needed is an assignment of the interface in order to use it as InterfaceField. Most important is to no delete OpenVPN configs when still hanging in FRR.
> 
> Also OSPF only works on TAP interface (cause of multicast) ...
> 
> When both are given it _should_ work.
> 
> Can anyone confirm this?

I use PtP OSPF with /31 tun openvpn networks all the time on other platforms (plain FreeBSD, Linux, Mikrotik,etc).  OPNSense allows me to configure 1 vpn tunnel this way, when trying to get a second one going today I discovered this.

I believe this should still be open as the assumption that OSPF only runs over TAP openvpn instances is incorrect

**Comment by mimugmail** [comment]
Have you tried to get this running with /31 tun setup?
Can you compare the generated output of OpenVPN config for OPNsense and yours on FreeBSD?

**Comment by brilthor** [comment]
@mimugmail yes, I've got openvpn itself working on opnsense with /31 tun setup.  You need to set the IPV4 runnel network, and then set the local and remote ip in advanced with 

```ifconfig <localip> <remoteip>```

This part works and I have multiple openvpn p2p /31 tun instances that are live and can ping, the trouble comes in trying to configure OSPF across them, it only works for the first openvpn tunnel

**Comment by mimugmail** [comment]
You have to assign each interface, add lock to prevent deletion and dont configure IP. Restart OpenVPN and then you can use these Interfaces in FRR like I wrote before ... Please verify and then we can close for sure :)

**Comment by fichtner** [comment]
the mvc code doesn't pull openvpn interfaces into the config as they use a different style...

**Comment by fichtner** [comment]
oh wait, please ignore me. this is about the assignment.

**Comment by brilthor** [comment]
sorry; apparently missed the enable as a required step, they show up in the webui now and generate a config.  That config appears to be broken, but that is FRR/OSPF UI related as opposed to VPN interface related.  

While this works as a workaround for interface assignment I assume that the plan would be in the future to have openvpn server configs show up as interfaces directly

**Comment by mimugmail** [comment]
What exactly is broken in FRR UI?

**Comment by brilthor** [comment]
just opened new bug:
https://github.com/opnsense/plugins/issues/941

it appears to assume a MD5 key id of 1
